Keyword,Recommended Page,Intent Category,Priority Level,Search Volume,CPC,Keyword Difficulty,Notes
Memphis DJ,Main DJ Services Landing Page,Commercial,High,300,$2.00,20,Primary broad keyword
DJ Memphis,Main DJ Services Landing Page,Commercial,High,300,$2.00,20,Primary broad keyword variant
wedding DJ Memphis,Wedding DJ Landing Page,Commercial,High,200,$3.00,20,Primary wedding keyword
Memphis wedding DJ,Wedding DJ Landing Page,Commercial,High,200,$3.00,20,Primary wedding keyword variant
Memphis DJs,Main DJ Services Landing Page,Commercial,High,150,$2.00,20,Plural variation
DJ in Memphis,Main DJ Services Landing Page,Commercial,High,150,$2.00,20,Local positioning
Memphis DJ services,DJ Services Page,Commercial,Medium,80,$2.00,15,Service-focused
DJ services Memphis,DJ Services Page,Commercial,Medium,80,$2.00,15,Service-focused variant
DJ for hire Memphis,Service Page,Commercial,Medium,50,$1.50,15,Hiring intent
hire a DJ in Memphis,Service Page,Commercial,Medium,50,$1.50,15,Hiring intent variant
wedding DJ Germantown TN,Germantown Location Page,Local,Medium,180,35,Suburb-specific
wedding DJ Collierville TN,Collierville Location Page,Local,Medium,160,33,Suburb-specific
wedding DJ Bartlett TN,Bartlett Location Page,Local,Medium,140,32,Suburb-specific
wedding DJ Cordova TN,Cordova Location Page,Local,Medium,120,30,Suburb-specific
wedding DJ Lakeland TN,Lakeland Location Page,Local,Medium,90,28,Suburb-specific
wedding DJ Millington TN,Millington Location Page,Local,Medium,80,27,Suburb-specific
wedding DJ Southaven MS,Southaven Location Page,Local,Medium,150,34,Cross-state suburb
wedding DJ Olive Branch MS,Olive Branch Location Page,Local,Medium,110,31,Cross-state suburb
wedding DJ Horn Lake MS,Horn Lake Location Page,Local,Low,70,26,Cross-state suburb
Memphis corporate DJ,Event DJ Services Page,Commercial,Medium,280,38,Business events
corporate event DJ Memphis,Event DJ Services Page,Commercial,Medium,220,36,Business events
birthday party DJ Memphis,Event DJ Services Page,Commercial,Medium,190,32,Personal celebrations
party DJ Memphis,Event DJ Services Page,Commercial,Medium,300,35,General party keyword
school dance DJ Memphis,Event DJ Services Page,Commercial,Medium,140,29,Educational events
prom DJ Memphis,Event DJ Services Page,Commercial,Medium,120,31,School-specific
bar mitzvah DJ Memphis,Event DJ Services Page,Niche,Low,60,25,Cultural celebrations
quinceañera DJ Memphis,Cultural Services Page,Niche,Low,80,27,Hispanic community
graduation party DJ Memphis,Event DJ Services Page,Commercial,Medium,110,30,Educational celebrations
anniversary party DJ Memphis,Event DJ Services Page,Commercial,Low,90,28,Personal celebrations
retirement party DJ Memphis,Event DJ Services Page,Commercial,Low,70,26,Personal celebrations
holiday party DJ Memphis,Event DJ Services Page,Commercial,Medium,150,33,Seasonal events
Memphis DJ company,Branded About Page,Branded,Medium,180,25,Company searches
M10 DJ Company,Branded About Page,Branded,High,120,15,Exact brand match
M10 DJ Company reviews,Reviews/Testimonials Page,Branded,Medium,90,20,Review searches
DJ Ben Murray,DJ Ben Murray Profile Page,Branded,Medium,110,18,Personal brand
DJ Ben Murray Memphis,DJ Ben Murray Profile Page,Branded,Medium,80,20,Geo-branded
Memphis DJ pricing,Pricing Page,Commercial,Medium,250,35,Pricing research
DJ cost Memphis,Pricing/FAQ Page,Informational,Medium,200,32,Cost research
how much does a wedding DJ cost Memphis,Pricing Blog Post,Informational,Medium,180,30,Long-tail pricing
wedding DJ prices Memphis,Pricing Page,Commercial,Medium,160,34,Pricing-specific
affordable DJ services Memphis,Pricing Page,Commercial,Medium,140,31,Budget positioning
DJ packages Memphis,Pricing Page,Commercial,Medium,120,33,Package searches
DJ Beale Street,Venue-Specific Page,Local,Medium,95,28,Iconic location
DJ Peabody Memphis,Venue-Specific Page,Local,Medium,70,32,Luxury venue
DJ Dixon Gallery Gardens,Venue-Specific Page,Local,Low,45,25,Wedding venue
DJ Memphis Botanic Garden,Venue-Specific Page,Local,Low,55,27,Wedding venue
DJ Memphis Zoo,Venue-Specific Page,Local,Low,40,24,Event venue
DJ Shelby Farms,Venue-Specific Page,Local,Low,60,26,Outdoor venue
DJ Lichterman Nature Center,Venue-Specific Page,Local,Low,35,22,Wedding venue
DJ Historic Elmwood Cemetery,Venue-Specific Page,Local,Low,25,20,Unique venue
DJ AutoZone Park,Venue-Specific Page,Local,Low,30,23,Sports venue
DJ with uplighting Memphis,Modifier Blog Post,Commercial,Low,85,29,Equipment feature
DJ with photobooth Memphis,Modifier Blog Post,Commercial,Low,70,27,Add-on service
DJ with karaoke Memphis,Modifier Blog Post,Commercial,Low,90,28,Entertainment feature
DJ who takes requests Memphis,Modifier Blog Post,Commercial,Low,110,26,Service feature
bilingual DJ Memphis,Cultural Services Page,Niche,Low,60,24,Language services
Spanish speaking DJ Memphis,Cultural Services Page,Niche,Low,75,26,Hispanic market
DJ con música en español Memphis,Cultural Services Page,Niche,Low,50,23,Spanish language search
wedding DJ vs band Memphis,Comparison Blog Post,Informational,Low,95,31,Decision-making content
DJ vs live band Memphis wedding,Comparison Blog Post,Informational,Low,70,29,Wedding-specific comparison
how to choose wedding DJ Memphis,Educational Blog Post,Informational,Low,85,25,Guidance content
wedding DJ checklist Memphis,Educational Blog Post,Informational,Low,60,22,Planning content
Memphis wedding music,Educational Blog Post,Informational,Low,120,24,Music selection content
popular wedding songs Memphis,Educational Blog Post,Informational,Low,100,26,Music planning
DJ equipment rental Memphis,Equipment Services Page,Commercial,Low,140,35,Equipment focus
sound system rental Memphis,Equipment Services Page,Commercial,Low,180,38,Audio equipment
Memphis DJ for hire,Service Page,Commercial,Medium,200,33,Hiring intent
hire DJ Memphis,Service Page,Commercial,Medium,190,32,Hiring intent variant
Memphis mobile DJ,Service Page,Commercial,Medium,160,30,Mobile service emphasis
traveling DJ Memphis,Service Page,Commercial,Low,80,27,Travel willingness
DJ services Shelby County,Location Page,Local,Medium,110,29,County-wide coverage
DJ services DeSoto County,Location Page,Local,Medium,90,28,Cross-state coverage
Memphis area DJ,Location Page,Local,Medium,150,31,Regional coverage
DJ Tennessee Mississippi border,Location Page,Local,Low,70,25,Regional positioning
Memphis entertainment services,Service Page,Commercial,Low,130,32,Broader entertainment
Memphis event entertainment,Service Page,Commercial,Low,120,30,Event focus
Memphis party entertainment,Service Page,Commercial,Low,140,29,Party focus
DJ for nonprofit events Memphis,Niche Services Page,Niche,Low,45,20,Nonprofit sector
charity event DJ Memphis,Niche Services Page,Niche,Low,40,19,Charitable events
church event DJ Memphis,Niche Services Page,Niche,Low,55,22,Religious events
Memphis DJ testimonials,Reviews/Testimonials Page,Branded,Low,50,15,Social proof
Memphis DJ portfolio,Portfolio Page,Branded,Low,40,18,Work showcase
Memphis DJ photos,Portfolio Page,Branded,Low,60,20,Visual content
Memphis DJ videos,Portfolio Page,Branded,Low,45,19,Video content
DJ mixing Memphis,Educational Blog Post,Informational,Low,70,24,Technical content
Memphis DJ mixing techniques,Educational Blog Post,Informational,Low,35,21,Technical education
professional DJ Memphis reviews,Reviews Page,Commercial,Medium,80,28,Review-focused commercial
5 star DJ Memphis,Reviews Page,Commercial,Medium,60,26,Rating-focused
top rated DJ Memphis,Best DJ Comparison Page,Commercial,Medium,120,35,Authority positioning
Memphis DJ awards,About/Awards Page,Branded,Low,25,16,Recognition content
award winning DJ Memphis,About/Awards Page,Branded,Low,30,18,Achievement positioning
experienced DJ Memphis,Service Page,Commercial,Medium,95,27,Experience emphasis
seasoned DJ Memphis,Service Page,Commercial,Low,40,23,Experience variant
Memphis DJ 15 years experience,About Page,Branded,Low,20,15,Specific experience claim
full service DJ Memphis,Service Page,Commercial,Medium,110,30,Comprehensive service
complete DJ services Memphis,Service Page,Commercial,Medium,85,28,Full-service positioning
Memphis DJ and MC,Service Page,Commercial,Medium,90,29,Dual service offering
MC services Memphis,MC Services Page,Commercial,Medium,120,32,Master of Ceremonies focus
Memphis wedding MC,MC Services Page,Commercial,Medium,100,30,Wedding MC specific
professional MC Memphis,MC Services Page,Commercial,Medium,80,28,Professional MC positioning
Memphis event lighting,Lighting Services Page,Commercial,Medium,150,34,Lighting services
uplighting rental Memphis,Equipment Page,Commercial,Medium,110,36,Specific equipment
Memphis sound equipment,Equipment Page,Commercial,Medium,180,38,Audio equipment broad
PA system rental Memphis,Equipment Page,Commercial,Medium,140,37,Specific audio equipment
Memphis microphone rental,Equipment Page,Commercial,Low,90,33,Specific audio equipment
wireless microphone Memphis,Equipment Page,Commercial,Low,70,31,Wireless audio equipment